date,amendment_id,affected_section,motivation,change,data_observed_before_change,why_not_result_improving,status
2026-06-25,A090_FIGURE_REFERENCE_CLOSURE,Figure and table reference closure,A presentation assessor could notice an unreferenced LaTeX-native figure or unresolved reference even if the PDF compiles.,Added a figure/table/algorithm reference-closure audit and fixed the method-pipeline figure reference in the main text.,The prior release had figure layout auditing but not reference closure; the method-pipeline figure was not explicitly referenced.,Presentation and traceability hardening only; no empirical result changes.,closed
2026-06-25,A091_SUPPLEMENT_MAIN_ALIGNMENT,Main supplement and artifact count synchronization,"Main paper, supplement, README, and reproduction surfaces can drift after late validation changes.","Added supplement-alignment auditing over current 110-layer, 100-command, reference, SpecBench, oracle, and evidence-card counts.",The prior release had stale-number audits but not a four-surface alignment gate for the release registration metadata.,Release consistency only; no labels or metrics move.,closed
2026-06-25,A092_ARTIFACT_MANIFEST_REACHABILITY,Artifact manifest reachability,A reproducibility assessor could find that a capsule entry or result-index row points to a missing file.,"Added artifact-manifest reachability auditing over required capsule files, result index rows, and checksum manifest size.",The prior release checked capsule presence but not the new quickstart/metadata surfaces and result-index reachability together.,Packaging hardening only; no scientific result changes.,closed
2026-06-25,A093_EVIDENCE_DIGEST_LEDGER,Canonical evidence digest ledger,"Late edits to evidence cards, claim traces, repairs, graph metrics, or references should be tamper-evident.","Added a canonical digest audit over the core source-claim, evidence-card, repair, graph, and reference surfaces.",The prior release had hash-chain auditing for witnesses but not a compact digest over the release evidence pack.,Integrity hardening only; no labels or conclusions change.,closed
2026-06-25,A094_ASSESSOR_TRIAGE_INDEX,assessor objection triage index,A large artifact can be correct but still hard to review under time pressure.,Added a assessor triage index and audit mapping common objections to concrete paper/artifact surfaces.,The prior release had entrypoint auditing but not an objection-to-evidence map.,Navigation hardening only; no experiment changes.,closed
2026-06-25,A095_RELEASE_DELIVERY_PACKET,release three-surface delivery packet readiness,"The submitted work is judged through main paper, supplement, and anonymous artifact link; these must close together.","Added release delivery-packet auditing over main PDF, supplement PDF, metadata/quickstart/triage surfaces, and 110-layer release validation.",The prior release had deliverable-trio readiness but not the new registration/quickstart/digest surfaces.,"release delivery hardening only; no denominator, labels, metrics, baselines, or RQs move.",closed
"2026-06-25","A096_OVERCLAIM_BOUNDARY_CLOSURE","Overclaim boundary closure","A release research surface can accidentally sound stronger than the evidence supports, especially after repeated polishing.","Added overclaim-boundary auditing over main paper, supplement, README, reproduction protocol, and study protocol; the audit rejects unqualified prevalence, exploitability, human-study, private-data, GPU, and full-browser-conformance claims.","The prior release had anonymity and rhetoric audits but not a semantic overclaim boundary gate over the release surfaces.","Scope guard only; no denominator, labels, metrics, baselines, or RQs move.","closed"
"2026-06-25","A097_COMPILED_PDF_TEXT_SURFACE","Compiled PDF text surface closure","LaTeX source audits can miss text introduced through included tables or compiled PDFs.","Added a compiled-PDF text audit that extracts main and supplement PDF text and rejects process traces, unresolved references, local paths, and assessor-process language.","The prior release caught source-level rhetoric issues but did not inspect compiled PDF text directly.","Presentation and hygiene hardening only; no scientific result changes.","closed"
"2026-06-25","A098_PUBLIC_PROVENANCE_AND_DATA_RIGHTS","Public provenance and data-rights closure","A reproducibility assessor may question whether public-source grounding or external-resource rights are explicit enough.","Added public-provenance auditing over source ledgers, source snapshots, external resources, environment lock, and package boundary flags.","The prior release had source-span closure and reference integrity but not a release data-rights/public-provenance gate.","Provenance hardening only; no result or baseline-scope changes.","closed"
"2026-06-25","A099_REPOSITORY_UPLOAD_PACKET","Manual repository-upload packet closure","The release anonymous repository will be uploaded manually, so the artifact tree needs a stable include/exclude manifest and pre-upload checks.","Added repository_upload_manifest.json and an audit checking BEPGuard upload root, required files, cache exclusion, and pre-upload validation commands.","The prior release had delivery-packet readiness but not a manifest for manual repository upload.","Packaging and upload-readiness hardening only; no denominator, labels, metrics, baselines, or RQs move.","closed"
