date,amendment_id,affected_section,motivation,change,data_observed_before_change,why_not_result_improving,status
2026-06-23,A030_SEMANTIC_MUTATION_FARM,Mutation adequacy and workload sensitivity,"Adversarial artifact review found that the original 28 hand-written semantic mutants were valuable but not enough to demonstrate workload sensitivity against broader omission, confusion, and over-generalization fault families.","Added a deterministic obligation-level mutation farm with 150 mutants over BEP-Deep issue, family, and intent classes; every mutant is killed only by a concrete locked fixture whose expected signature differs from the mutant oracle.",The previous 28/28 mutation gate already passed; the new farm increases mutation pressure without using outcomes to change the corpus.,"Mutation-farm mutants are validation burden only and do not alter any witness, fixture label, denominator, baseline status, effect size, or RQ.",closed
2026-06-23,A031_PAPER_SYNC_AND_VISUAL_DENSITY,"Paper/source synchronization, reference count, and rendered PDF audit","Paper-level review found that new repository and theory contributions had to be reflected in the main text while preserving the 10-page body, 2-page reference boundary, double-anonymous constraints, and a 70-80 real-reference target.","Synchronized the main paper and supplement with rule maturity, finite theorem kernel, expanded SpecBench, mutation farm, and 42-layer release validation; added verified references to reach the 70-80 target and added a rendered-PDF visual-density audit checking 12 pages, page-10 body fill, page-11 reference start, and citation/BibTeX closure.","The prior paper compiled to 12 pages and 68 references; page 10 was already visually full, but the reference set and validation counts lagged behind the new artifact state.","This updates presentation and compliance after validation hardening; it does not hide limitations, fabricate references, or change BEP-Deep/BEP-Max outcomes.",closed
2026-06-23,A032_FULL_EXTERNAL_COMPARATOR_RUN,"External baselines, baseline protocol, and release validation",assessor-level artifact review found that external-baseline handling still relied too heavily on availability contracts; available public packages needed a full fixture-level execution record without packaging caches or dependency directories.,"Executed unmodified public-package comparator analyzers outside the release tree over all 972 BEP-Deep fixtures, producing 4118 fixture-level comparator invocations and an audit with zero unavailable or error rows; added package/version/provenance locks and cache-exclusion checks to release validation.",The previous release had baseline-contract audits and fixture-level probe records but did not contain a full available-package execution over the entire BEP-Deep denominator.,"The run is a contrastive external-comparator execution and no-substitution audit; it does not change labels, denominators, semantic oracle results, RQs, or baseline-scope interpretation.",closed
2026-06-23,A033_THEORY_KERNEL_AND_MUTATION_FARM_EXPANSION,Formal validation and mutation adequacy,A strong formal/program-analysis review found that the finite theorem kernel and obligation-level mutation farm should be substantially stronger before being treated as a best-paper-level validation object.,"Expanded the finite theory kernel from 10 theorems over 1649 states to 20 theorems over 12517 states, and expanded the obligation-level mutation farm from 150 to 300 killed mutants with concrete locked-fixture mismatch witnesses.","The 10-theorem kernel, 150-mutant farm, original 28 rule mutants, 972/418/554 BEP-Deep denominator, and 4306 BEP-Max validation were already passing.","This adds independent validation pressure outside the locked denominator and does not add, delete, relabel, reinterpret, or rescore any fixture, negative control, baseline row, metric, or RQ.",closed
2026-06-23,A034_SPECBENCH_STRESS_EXPANSION,Source-derived boundary benchmark and robustness validation,Benchmark review found that BEP-SpecBench needed more representation stress beyond header case/order/padding to reduce concerns that source-derived cases were too close to the locked fixtures.,"Expanded BEP-SpecBench from 232 to 696 source-derived boundary and representation-stress cases by adding semantics-preserving context, header, cache, reporting, and irrelevant-field variants for the covered rule aliases.","BEP-SpecBench 232/232, metamorphic 3954/3954, and BEP-Max 4306/4306 were already passing.","SpecBench remains a validation-pressure benchmark outside the BEP-Deep denominator; it does not alter labels, metrics, baseline scope, RQs, or headline effect sizes.",closed
2026-06-23,A035_PAPER_SYNC_WITH_EXTERNAL_RUN,"Paper, supplement, result tables, and release manifests","Paper-level review found that the full external comparator run, stronger theorem kernel, expanded mutation farm, and larger SpecBench needed to be visible in the main paper while preserving the 10-page body and 2-page reference boundary.","Synchronized main paper, supplement, validation tables, baseline comparison, release documentation, result index, checksum manifest, and audit summaries with the 44-layer validation state, 4118 external comparator invocations, 696 SpecBench cases, 20-theorem kernel, and 300-mutant farm.","The paper already compiled to 12 pages with references starting on page 11 and 72 references, but its main evaluation text lagged behind the earlier release artifact state.","This is a presentation and release-consistency synchronization after validation hardening; it does not fabricate references, hide unavailable tools, or change BEP-Deep/BEP-Max outcomes.",closed
2026-06-24,A036_SHADOW_GENERALIZATION_AND_OVERFIT_AUDIT,"Benchmark independence, representation invariance, and anti-overfitting review",A fresh repository review found that the locked BEP-Deep denominator was well validated but still vulnerable to a assessor asking whether implementation behavior was memorizing fixture surfaces rather than preserving browser-policy semantics under benign representation changes.,"Added BEP-Shadow, a semantics-preserving shadow-generalization audit that transforms all 972 locked fixtures with six required representation-preserving transformations and two reported alpha-renaming probes; 5832 required shadow cases preserve the expected issue signature with zero failures, while optional alpha dependencies are reported rather than hidden.","The previous anti-overfit leakage scan passed over method files and locked IDs, but it did not re-execute every fixture under independent shadow IDs and representation perturbations.","The shadow workload is outside the locked BEP-Deep denominator and does not alter any fixture, label, witness, baseline status, metric, or RQ; it adds non-overfitting validation burden only.",closed
2026-06-24,A037_THEORY_MUTATION_SPECBENCH_DEEPENING,"Finite theory kernel, mutation farm, and source-derived boundary benchmark","A strong formal/program-analysis review found that earlier release's 20-theorem kernel, 300-mutant farm, and 696-case SpecBench were credible but could be deepened further before claiming best-paper-level rigor.","Expanded the finite theory kernel to 30 semantic obligations over 33513 enumerated states, expanded the obligation-level mutation farm to 600/600 killed mutants, and expanded BEP-SpecBench to 1392 source-derived boundary and representation-stress cases while preserving all existing BEP-Deep/BEP-Max outputs.","The 20-theorem kernel, 300-mutant farm, 696-case SpecBench, 28/28 semantic mutants, and 44-layer validation already passed.","This increases validation pressure and proof depth outside the empirical denominator; it does not change labels, denominators, negative controls, baselines, effect sizes, or RQs.",closed
2026-06-24,A038_EXTERNAL_PROVENANCE_CACHE_EXCLUSION,External comparator provenance and cache hygiene,"External-baseline review found that the full public-package comparator run needed a stricter proof that dependency caches, node_modules, temporary probe files, and external work directories were not packaged or silently consulted by release validation.","Added an external provenance audit that checks the 4118 materialized comparator rows, package/version locks, comparator task coverage, manifest agreement, and absence of node_modules, package caches, transient probe files, and archive artifacts in the release tree.","The earlier release external comparator run already reported 4118 invocations and zero unavailable/error rows, but cache-exclusion evidence was split across package locks and clean-package checks.","This is a provenance/cache-closure audit; it does not introduce a new external tool claim, substitute internal logic, or change any comparator outcome, label, metric, or RQ.",closed
2026-06-24,A039_SCALE_STRESS_AND_EVIDENCE_REDUNDANCY,Scalability replay and evidence-channel closure,Artifact inspection found that the repository should show not only locked counts but also deterministic scale-stress replay and a compact proof that accepted findings are supported by many independent evidence channels.,"Added a BEP-Scale stress replay over 24300 deterministic representation-preserving variants and an evidence-redundancy audit checking active channels across source spans, rules, certificates, repairs, evidence graph paths, SpecBench, theory kernel, mutation farm, shadow transformations, and external comparator records.","The release already included BEP-Max 4306/4306, evidence graph closure, certificate replay, and strict smoke execution, but there was no single audit tying those channels together with a larger deterministic replay workload.","Scale stress and redundancy are validation gates outside the locked research denominator; they do not add new empirical positives, remove failures, or reinterpret baselines.",closed
2026-06-24,A040_LATEX_FIGURE_LAYOUT_AND_PAPER_SYNC,"Main-paper figures, visual layout, and validation synchronization","Presentation review found that assessor-first evidence should include a LaTeX-native figure/layout audit and that main-paper counts needed to reflect shadow generalization, stronger SpecBench, theory, mutation, scale, redundancy, and 49-layer validation while keeping page 10 full and references on pages 11-12 only.","Added a LaTeX-native figure-layout audit checking resolved figure inputs, absence of raster figures, TikZ node uniqueness, label uniqueness, caption coverage, rendered page boundaries, and figure/table caption pages; synchronized main paper, supplement, protocol, reproduction ladder, and release validation with earlier release counts.","The earlier release paper passed 10+2 page and reference checks, but its visual/presentation audit did not explicitly check figure source structure or overlap-risk proxies.","This updates presentation and compliance after repository hardening; it does not fabricate references, alter claims, or change BEP-Deep/BEP-Max outcomes.",closed
2026-06-24,A041_IDENTIFIER_BLIND_REPLAY_AND_REPAIR_DELTA,"Anti-overfitting validation, repair proof obligations, and reproduction ladder","A fresh artifact review found that fixture-level leakage checks and shadow transformations should be complemented by direct semantic replays after erasing source IDs, fixture IDs, roles, expected labels, families, variants, and hashes, and by a pairwise repair audit that verifies each counterfactual repair still clears the target issue without relying on metadata.","Added identifier-blind replay over all 972 BEP-Deep fixtures in five erasure modes, producing 4860 preserved semantic replays; added repair-delta replay for all 418 positive/repair pairs, including fully-blind repaired-side replay and observable header/context/layer/intent delta checks.","The earlier release release already had anti-overfit leakage scans over 104 method files, 5832 shadow-generalization replays, 24300 scale-stress cases, proof-carrying certificates, and local repair-frontier metrics, but it did not erase all benchmark metadata before re-executing the oracle.","This adds non-overfitting validation pressure and pairwise repair replay outside the locked denominator; it does not change fixture labels, baselines, metrics, RQs, or BEP-Deep/BEP-Max outcomes.",closed
2026-06-24,A042_SPECBENCH_AND_SHADOW_COMPOSITE_STRESS,Source-derived boundary benchmark and representation-invariance stress,"A strong benchmark review found that SpecBench and BEP-Shadow should exercise not only single perturbations but also composite representation changes that combine normalization, irrelevant metadata, cache/reporting fields, and context expansion.","Expanded BEP-SpecBench from 1392 to 2755 source-derived boundary/composite-stress cases and expanded BEP-Shadow from six to ten required representation-preserving transformations, increasing required shadow replays from 5832 to 9720 with zero failures.",The earlier release release already passed 1392 SpecBench cases and 5832 required shadow replays; those were strong but still mostly single-perturbation workloads.,"The added cases remain outside the BEP-Deep empirical denominator and are generated from semantics-preserving transformations; they do not add empirical positives, remove failures, reinterpret baselines, or alter headline counts.",closed
2026-06-24,A043_PROOF_CARD_AND_SCALE_REPLAY_EXPANSION,"Theory presentation, scale stress, and release validation synchronization","A formal/reproducibility review found that the finite theorem kernel should have compact proof cards that exactly account for the executable theorem obligations, and that scale replay should be deepened before the repository is considered best-paper-grade.","Added a proof-card audit for all 30 theorem obligations, checking claim/proof-kind/state accounting against the theorem kernel; increased BEP-Scale replay to 48600 deterministic stress cases; synchronized release validation, reproduction ladder, paper, supplement, result index, and checksum manifest with 52 validation layers.","The earlier release release had 30 theorems over 33513 states, 24300 scale-stress cases, and 49 validation layers; proof accounting was available in JSON but not separately validated as evidence-facing proof cards.","This strengthens proof presentation and replay workload without changing the locked denominator, labels, baseline scope, RQs, or semantic results.",closed
2026-06-24,A044_CAUSAL_COUNTERFACTUAL_ACTIVATION,Negative-control activation and anti-overfitting review,A fresh methodology review found that preserving negative controls and clearing repairs did not by itself prove that clean controls sit on the intended semantic boundary; assessors could ask whether the oracle only recognizes positives already present in BEP-Deep.,Added causal counterfactual activation over activatable clean controls: paired repairs are reversed to their positives and clean controls in encoded intent classes receive targeted causal edits; 546/546 required activations cross the semantic boundary and emit the expected issue.,"The earlier release had 554 clean controls, 418 repair-delta pairs, 4860 identifier-blind replays, and 9720 shadow replays, but no complementary activation gate from clean controls to issue-emitting counterfactuals.","The audit creates out-of-denominator counterfactuals and does not relabel locked controls, delete failures, change baselines, or move any RQ/metric/denominator.",closed
2026-06-24,A045_EXTERNAL_CONTRAST_SPECIFICITY,External comparator interpretation,A baseline review found that the paper should not only report full public-package execution but also quantify why scanner-style flags are contrastive evidence rather than intent-drift labels.,"Added an external contrast-specificity audit over 4118 public-package comparator rows, computing fixture-level flag behavior for all 418 semantic positives and 554 clean controls and documenting that raw comparator flags are not used as BEP labels.","The earlier release had full public-package comparator outputs with zero unavailable/error rows, but it did not separately quantify comparator specificity over the locked semantic denominator.","This analysis interprets already materialized external outputs; it does not create new semantic positives, replace the BEP oracle, or tune results by comparator agreement.",closed
2026-06-24,A046_BENCHMARK_DISJOINTNESS_AND_RUNTIME_BOUNDARY,Benchmark-adjacent independence and deterministic runtime closure,"Repository review found that benchmark-adjacent validation objects should have explicit fingerprint/id disjointness checks and that the release should independently prove absence of dependency caches, transient build products, GPU/API requirements, and packaged repository state.","Added benchmark fingerprint-disjointness checks over 8161 benchmark-adjacent rows and a runtime-boundary audit over the artifact tree, confirming no node_modules/cache/git/bytecode/LaTeX transient files and no GPU, commercial API, or network requirement for the core ladder.","The earlier release had anti-overfit ID scanning, clean-package checks, and external-provenance checks, but these concerns were split across gates and did not explicitly audit benchmark-adjacent fingerprints and runtime boundary in one place.","The audits add reproducibility and independence checks only; they do not change fixtures, labels, oracle rules, baselines, or headline counts.",closed
2026-06-24,A047_PAPER_CLAIM_CONSISTENCY_AND_SYNC,Paper-visible claim closure and release synchronization,"Paper-first review found that assessor-visible numerical claims in the main PDF must be machine-checked against materialized validation outputs, especially after adding new causal, external-contrast, disjointness, and runtime-boundary gates.","Added a paper-claim consistency audit for headline numbers and synchronized main paper, supplement, reproduction ladder, release validation, result index, and checksum manifest with 57 validation layers and 46 reproduction-ladder commands.","The earlier release had 52 validation layers and paper/PDF audits, but no dedicated check that main-paper headline numbers matched the release-validation ledger after the newest repository hardening.","This is consistency synchronization; it does not alter the locked experimental denominator, labels, baselines, or semantic outcomes.",closed
2026-06-24,A048_THIRD_ORACLE_AND_LABEL_FLOW_SEPARATION,Oracle adequacy and anti-overfitting validation,A strict program-analysis review found that two executable oracles and metadata-erasure replays still left a possible attack: semantic decision code might accidentally consult benchmark labels or lack a fully declarative third oracle.,"Added a declarative label-free oracle over BEP-Deep and BEP-SpecBench, producing 4392 third-oracle agreement checks; added a static label-flow audit ensuring pure semantic decision procedures do not read expected labels, fixture roles, source identifiers, hashes, or certificate identifiers.","The earlier release had operational semantics, a decision-table oracle, identifier-blind replay, causal activation, and leakage audits, but no separate declarative clause oracle and no static proof that core decision files avoid label fields.","This adds independent validation and static purity checks outside the locked denominator; it does not change labels, rules, baselines, RQs, or headline BEP-Deep/BEP-Max outcomes.",closed
2026-06-24,A049_ISSUE_EVIDENCE_DEPTH_CLOSURE,Benchmark adequacy and evidence coverage,"A benchmark review found that several locked issue classes had no direct source-derived SpecBench pressure, so aggregate SpecBench counts could hide per-class evidence gaps.","Added seven missing source-derived SpecBench base cases and their representation-stress variants, expanding SpecBench from 2755 to 3420 cases over 26 rule aliases; added an issue-evidence-depth audit that checks 25 issue classes across 200 per-class evidence obligations.","The new audit initially found seven issue classes without direct SpecBench coverage: duplicate ACAO, dynamic credentialed CORS missing Vary, CSP conjunctive composition, frame-ancestors report-only/meta delivery, HSTS subdomain scope, and layered header removal.","The added cases are out-of-denominator validation pressure; they do not alter BEP-Deep labels, positive/control counts, baseline scope, or detector outcomes.",closed
2026-06-24,A050_STRICT_REFERENCES_ONLY_BOUNDARY,paper delivery-format and rendered-PDF boundary,A paper-first review found that the references-only boundary should be checked by a strict rendered-PDF audit rather than by a loose text-excerpt heuristic.,"Added a strict PDF reference-boundary audit requiring page 10 to remain body text, page 11 to start with the References heading, references to occupy pages 11-12 only, and page 10 visual density to meet the rendered-body threshold.","The earlier release had a rendered density audit and visual checks, but the check only required that page 11 contain the word references and did not separately verify the first page-11 region.","This is a compliance and presentation gate; it does not change experimental data, baselines, or claims.",closed
2026-06-24,A051_RELEASE_BOUNDARY_SYNCHRONIZATION,"release validation, reproduction ladder, and paper synchronization","After adding third-oracle, label-flow, issue-depth, and strict PDF-boundary gates, all evidence-facing ledgers and paper counts needed a single synchronization point to prevent stale claims.","Updated release validation from 57 to 61 layers, reproduction ladder from 46 to 50 commands, paper/supplement/README/protocol text, validation orchestration, result index, checksum manifest, and audit summaries to the earlier release state.",The earlier release passed 57 layers but did not include the four new earlier release gates and still had aggregate SpecBench counts that obscured per-issue coverage gaps.,"This is synchronization after validation hardening; it preserves the locked denominator, labels, RQs, baseline scope, and headline BEP-Deep/BEP-Max outcomes.",closed
2026-06-24,A052_WHOLE_CORPUS_STABILITY_REPLAY,"Anti-overfitting, representation invariance, and semantic stability","A fresh artifact review found that identifier-blind replay and shadow transformations were strong, but the locked denominator still needed a simple whole-corpus replay proving that neutral response fields, unused context metadata, and flat header ordering do not affect semantic judgments.","Added a whole-corpus semantic stability audit that replays all 972 BEP-Deep fixtures under three policy-irrelevant perturbations, producing 2916/2916 preserved issue signatures with zero failures.","The earlier release passed 61 layers, including identifier-blind replay, shadow generalization, declarative oracle, label-flow checks, and issue-evidence depth closure, but did not contain a compact all-fixture neutral perturbation gate.","The new replay is out-of-denominator validation pressure; it does not add, delete, relabel, rescore, or reinterpret any locked fixture, baseline, metric, or RQ.",closed
2026-06-24,A053_ASSESSOR_EVIDENCE_CARDS,"Evidence presentation, assessor inspection, and proof-to-repair traceability",A evidence-facing artifact review found that evidence graph paths were complete but still required cross-file reconstruction; a strict assessor should be able to inspect a single finding as a compact source-to-repair evidence card.,"Added evidence-facing evidence cards for all 418 positive witnesses, each binding fixture, issue, policy family, source claim, rule, certificate id, witness explanation, paired repair control, evidence graph path, and certificate-obligation status.","The earlier release had evidence graph closure over 14422 nodes and 22405 edges plus 418 verified positive paths, but it did not materialize one-card-per-finding inspection objects.","Evidence cards are presentation and audit objects derived from existing validated paths; they do not create new findings, change outcomes, or substitute for the semantic oracle.",closed
2026-06-24,A054_DECISION_PURITY_AND_VERSION_CLOSURE,"Decision purity, package identity, and code-quality review","A code-quality review found two concrete repository weaknesses: pyproject and bepguard.__version__ disagreed, and the static label-flow audit covered only a narrow pair of pure decision files rather than the broader policy-decision surface.","Synchronized package versioning to 0.18.0 and added an AST-level decision-purity audit over operational semantics, decision-table oracle, declarative oracle, and corpus-stability decision functions, checking 78 pure decision functions for forbidden label/source/hash/certificate metadata access.","The earlier release had a 2-file label-flow audit and repository-quality pass, but version identity drift and a narrow purity surface remained attackable artifact-quality issues.","This closes repository identity and static purity risks only; it does not change semantic rules, labels, fixtures, baselines, or headline results.",closed
