date,amendment_id,affected_section,motivation,change,data_observed_before_change,why_not_result_improving,status
2026-06-20,A001_K_LOCK_ACTIVATION,K lock,"Materialize claim-level corpus, fixture manifest, source snapshots, rule-source ledger, and checksums before full execution.","Activated the full-experiment denominator: 40 claims, 82 fixtures, 62 positives, 20 negative controls.",Pilot-only feasibility results; no locked full result observed.,This fixes denominator and prevents later deletion or relabeling; it does not use full results.,closed
2026-06-20,A002_EXTERNAL_BASELINE_STATUS,Baselines,External baseline packages/services are not all executable in the offline deterministic environment.,Record exact unavailable/pinned statuses and execute only separately labeled internal controls.,No external full-baseline result observed.,Unavailable baselines are not replaced; disagreement metrics are labeled internal controls.,closed
2026-06-20,A003_L_EXECUTION_RECORD,L execution,Record locked full-experiment execution after K activation.,"Ran locked oracle, controls, minimizer, ablations, robustness, and scalability on unchanged 82-fixture denominator.",K lock hashes and denominator only.,Execution record; no RQ/metric/label/denominator change.,closed
2026-06-20,A004_PROTOCOL_TEXT_COUNT_CORRECTION,Study protocol locked corpus denominator paragraph,Align prose with materialized corpus and protocol-lock counts.,"Corrected protocol narrative claim-row count to 40; fixture count, positives, negatives, RQs, metrics, baselines, and results unchanged.",Locked corpus_claims.csv already contained 40 rows and locked fixture denominator already contained 82 fixtures.,"Text-only consistency correction; no row, label, oracle rule, metric, result, baseline, or negative control changed.",closed
2026-06-20,A005_CLAIM_SCOPE_CLARIFICATION,K/L interpretation and paper claim lock,Prevent overstatement of the locked source-claim corpus as if every claim row had an executed fixture.,Clarified that 40 public claim rows are in the source corpus; 19 claims are linked to the 82-fixture executed denominator; 21 claims are contextual/nonexecuted evidence.,"Locked full results already completed; no metrics, fixtures, labels, oracle outputs, or baselines changed.",This restricts paper claims and separates executed evidence from contextual evidence; it cannot improve any result.,closed
2026-06-20,A006_SUBSTANTIVE_WORKLOAD_EXPANSION,"K/L denominator, algorithmic workload, and evidence graph",Coverage analysis identified insufficient algorithmic and workload breadth for the intended claim boundary.,"Expanded to BEP-Stress: 44 claims, 35 rules, 116 base fixtures, 554 stress fixtures, 418 positives, and 136 negatives; added layered composition, CORS cache context, HSTS scope/preload cases, CSP framing/composition, CORP/Permissions edge cases, repair synthesis, metamorphic variants, and an effective-exposure graph.","Seed run had 44 claims, 35 rules, 116 base fixtures, 88 positives, and 28 negatives; the BEP-Stress denominator was recorded before upgraded interpretation.","The amendment expands rather than filters: seed families remain, added edge families include new positives and new negatives, and no old failures were deleted or relabeled.",closed
2026-06-20,A007_BEP_DEEP_REPAIR_CONTROL_HARDENING,"K/L denominator, semantic-core verification, witness minimality, and repair controls",Post-upgrade audit identified that BEP-Stress positives and repairs could be attacked as self-confirming without paired repair negative controls and independent proof obligations.,"Expanded BEP-Stress to BEP-Deep by adding 418 paired repair negative controls; reran the oracle on 972 fixtures; added finite-state semantic-core verification, minimality certification, and repair-obligation validation.","BEP-Stress had 554 fixtures, 418 positives, 136 negatives, 418 repairs, and 348 stable variants before BEP-Deep execution.",The amendment adds controls and proof obligations rather than deleting failures or relabeling positives; it increases the negative-control burden and keeps all old positives traceable.,closed
2026-06-20,A008_INDEPENDENT_ORACLE_AND_MUTATION_AUDIT,"Validation, oracle independence, and workload adequacy",Validation analysis identified that BEP-Deep needed independent oracle redundancy and semantic mutation adequacy to address oracle/workload coupling.,Added an independent decision-table oracle cross-check over all 972 locked fixtures and 351 generated finite states; added 28 semantic mutants covering weakened and over-reporting rule distortions; added evidence redundancy audit over 45 claims and 35 rules.,"BEP-Deep results already contained 972 fixtures, 418 positives, 554 negatives, repair controls, minimality certificates, and finite-state verifier outputs.",The amendment adds validation burdens without changing fixture labels or selecting results; surviving mutants or oracle mismatches would have weakened the paper rather than improving counts.,closed
2026-06-20,A009_CLAIM_LEDGER_AND_PROOF_CERTIFICATES,"Claim ledger, validation, and proof-carrying witness certificates",release validation found that the HSTS preload fixture family used CL_HSTS_05 in BEP-Deep but the source claim ledger had not materialized that explicit claim row; the same pass added row-local proof-carrying witness certificates.,Added CL_HSTS_05 for the HSTS preload eligibility intent; synchronized 35-rule ledgers; regenerated deep fixture manifest/checksums; added certificate generation and verification for 418/418 positive witnesses.,"BEP-Deep labels, oracle outputs, negative controls, repair controls, finite-state checks, and mutation results were already locked; the claim-ledger row was a traceability completion, not a result filter.","The amendment adds a required source row and certificate burden; it does not delete, relabel, or add positive findings, and certificate failures would have weakened the paper delivery.",closed
2026-06-20,A010_BEP_MAX_ADVERSARIAL_VALIDATION,"Validation, repair-frontier certification, and graph traceability",Validation analysis identified that BEP-Deep needed adversarial surface variants and local repair-frontier checks around the locked denominator.,Added BEP-Max adversarial validation with 4306 generated cases; added 418 contrastive repair-pair checks; added 418 repair-frontier certificates over 1230 local candidates; enriched the exposure graph with certificate and repair-control edges; added issue-class boundary-coverage audit.,"BEP-Deep labels and oracle outputs were already locked: 972 fixtures, 418 positives, 554 negatives, 418 proof-carrying certificates, and 28 killed semantic mutants.",The amendment adds validation burdens around locked results without adding or relabeling positive findings; failures would have exposed weakness rather than improving result counts.,closed
2026-06-20,A011_SOURCE_SPAN_CLOSURE,release traceability audits,Strict review found that source_span_ledger.csv was stale relative to the release admitted claim table.,Regenerated source_span_ledger.csv to cover all 45 admitted claims and added deterministic source-span closure audit.,"BEP-Deep labels, metrics, denominator, baselines, and expected outcomes were already locked and unchanged.","Traceability closure only; no fixture, source claim, label, metric, baseline, negative control, or result was added, removed, or relabeled.",closed
2026-06-20,A012_LATEX_SOURCE_INTEGRITY,Paper-source and release validation,Strict source review found non-rendered prose after the supplement end marker and main-paper release-gate wording that looked like implementation mechanics.,"Removed dead source content after the supplement end marker, moved the necessary release-consistency explanation into rendered supplement text, rewrote main-paper release-gate prose as validation-state coherence, and added a LaTeX source-integrity audit.","BEP-Deep and BEP-Max labels, metrics, denominators, certificates, and validation results were already locked and unchanged.","Paper-source hygiene and rendered-prose repair only; no fixture, source claim, label, metric, baseline, negative control, or result was added, removed, or relabeled.",closed
2026-06-20,A013_MATERIALIZATION_LINEAGE_CLOSURE,Seed-lineage materialization and release validation,"Strict reproduction review found that the seed materialization path printed denominator-shaped output and refreshed only some rule-ledger aliases, which could make lineage data appear to be the release BEP-Deep denominator.","Made seed materialization output explicitly scope-tagged, refreshed all canonical rule-ledger aliases, rewrote protocol_corpus_lock as a seed-lineage record, and added a materialization-lineage audit to release validation.","BEP-Deep/BEP-Max labels, metrics, denominators, certificates, and validation results were already locked and unchanged.","Lineage-closure only; no fixture, source claim, label, metric, baseline, negative control, or result was added, removed, or relabeled.",closed
2026-06-20,A014_VALIDATION_REPORT_AND_LINEAGE_SCOPE_CLOSURE,Release validation and traceability reports,"Strict release review found that the public coding-validation report and auxiliary source ledgers could lag behind the release 45-claim admitted corpus, and lineage result directories lacked explicit scope markers.","Regenerated the release coding-validation report from the release corpus, regenerated auxiliary source ledgers from the admitted-source snapshot manifest, added explicit seed/BEP-Stress lineage scope markers, and added a validation-report consistency audit to release validation.","BEP-Deep/BEP-Max labels, denominators, certificates, oracle outputs, mutation adequacy, and repair-frontier results were already locked and unchanged.","Report and lineage-scope closure only; no fixture, label, metric, baseline, negative control, or result was added, removed, or relabeled.",closed
2026-06-20,A015_SEMANTIC_RECOMPUTATION_CLOSURE,release semantic recomputation gate,Strict release review found that the release validation gate mainly checked materialized summaries and did not recompute the central semantic outcomes from released inputs.,"Added a deterministic semantic-recomputation audit that reruns the BEP-Deep operational oracle, independent decision-table oracle, finite-state cross-checks, and BEP-Max dual-oracle/hash/source/label checks from the released inputs.","BEP-Deep/BEP-Max labels, denominators, certificates, oracle definitions, and result counts were already locked and unchanged.","Recomputation closure only; no fixture, label, metric, baseline, negative control, RQ, or result was added, removed, relabeled, or reinterpreted.",closed
2026-06-20,A016_RELEASE_LANGUAGE_INTEGRITY,Release-facing source/resource metadata and release validation,Strict release review found provisional pre-lock language in source/resource ledgers and obsolete plan files that could make the release artifact appear unfinished.,"Collapsed source_manifest.csv to the release admitted-source universe, cleaned external resource statuses, removed unused pre-lock plan CSVs, added an anonymous artifact license, and added a release-language integrity audit to release validation.","BEP-Deep/BEP-Max labels, denominators, metrics, oracle definitions, certificates, baselines, and result counts were already locked and unchanged.","Release-language hygiene only; no fixture, source claim, label, metric, baseline, negative control, RQ, or result was added, removed, relabeled, or reinterpreted.",closed
2026-06-20,A017_BIBLIOGRAPHIC_METADATA_HYGIENE,Reference integrity and release validation,Strict reference review found that some cited records still used preprint-style or type-inaccurate BibTeX metadata even though published DOI metadata was available.,"Upgraded published-version metadata for CSP nonce reuse and HTTP security-header measurement references, corrected thematic-analysis BibTeX type, added a bibliographic-metadata audit to reject preprint/arXiv entries typed as conference proceedings and to check known published DOI/venue records.","The cited set, text claims, and reference count were already locked; the defect was metadata quality in cited entries and the reference ledger.","Bibliographic metadata hygiene only; no experiment result, source claim, fixture, label, metric, baseline, negative control, or citation count was added or removed.",closed
2026-06-20,A018_PDF_SOURCE_COMPILE_CLOSURE,Paper source integrity and release validation,"Strict source-review found that previous gates checked paper source hygiene and rendered PDFs, but did not compile the paper sources in an isolated temporary directory as a release validation layer.","Added an isolated PDF source-compile audit that runs the main paper through LaTeX and BibTeX, compiles the supplement, checks page counts, reference-page boundary, undefined citations/references, and overfull boxes, and leaves no build products in the release package.",The PDFs were already page-compliant and the cited set was already key-consistent; the gap was an executable source-compile gate.,"Compilation-closure only; no experiment result, source claim, fixture, label, metric, baseline, negative control, or paper claim was added, removed, relabeled, or reinterpreted.",closed
2026-06-20,A019_VALIDATION_ORCHESTRATION_STABILITY,release validation orchestration and source-compile audit,"Strict reproduction review found that the monolithic release-validation entry point could become unstable in constrained environments when it launched every heavy audit as nested subprocesses, and the BibTeX resolver selected a dangling bibtex alternatives symlink before a working bibtex.original executable.",Made the release-validation entry point memory-stable by checking materialized outputs from the full validation ladder without nested subprocess orchestration; kept heavy semantic-recomputation and isolated source-compilation gates separately reproducible; hardened the source-compile audit to select only a probe-validated BibTeX executable and to bound LaTeX log capture.,"BEP-Deep/BEP-Max labels, denominators, oracle outputs, certificates, mutation adequacy, source-compile result, and PDF page counts were already locked and unchanged.","Validation-orchestration robustness only; no fixture, source claim, label, metric, baseline, negative control, RQ, citation, or result was added, removed, relabeled, or reinterpreted.",closed
2026-06-22,A020_DIRECTIVE_FALLBACK_CONFORMANCE,Semantic core and release validation,"Strict source-level review found that the encoded CSP script-element fallback helper selected script-src before script-src-elem, contrary to the admitted CSP3 fallback obligation, and no locked fixture contained both directives to expose the defect.",Corrected the operational oracle and independent decision-table helper to select script-src-elem before script-src before default-src for script-element requests; added a deterministic directive-fallback conformance audit with six source-grounded micro-obligations and added it to release validation.,"BEP-Deep/BEP-Max fixture labels, denominator, oracle outputs, certificates, mutation adequacy, repair frontier, baseline/control results, and paper page counts were already locked and unchanged; the defect was found by source-level review, not by selecting on a result.","Conformance closure only; it adds validation burden and repairs the encoded semantic helper without adding, deleting, relabeling, or reinterpreting any fixture, result, baseline, negative control, RQ, or citation.",closed
2026-06-23,A021_CORS_MODED_RESOURCE_OPT_IN,"Semantic core, independent oracle, and cross-policy validation",Strict cross-policy review found that COEP require-corp resource opt-in must treat CORS authorization as applicable only for explicit cors-mode requests; the previous encoded helper could credit an ACAO header on a no-cors embedding edge.,"Gated the COEP/CORS opt-in path by request_mode == cors in both the operational oracle and the independent decision-table oracle; added an executable cross-policy contract verifier with 7 contracts and 111 finite states, including a COEP resource-opt-in obligation.","BEP-Deep/BEP-Max denominator, labels, certificates, baseline/control status, and 24-layer validation were already locked; the defect was exposed by a new source-level cross-policy contract, not by filtering result rows.","The amendment corrects encoded semantics and adds validation burden; after recomputation the locked 972/418/554 denominator and all existing result counts remain unchanged, so no positive, negative control, metric, RQ, or baseline scope is improved by selection.",closed
2026-06-23,A022_BASELINE_CONTRACT_AND_DEEP_PROBE,"External baseline wrappers, comparator status accounting, and release validation","Code review found that baseline wrapper result statuses used implementation-shaped names and BEP-Deep lacked a fixture-level external-baseline probe, weakening comparator reproducibility and scope separation.","Normalized wrapper statuses to a canonical comparator contract, regenerated full, stress, and BEP-Deep baseline availability/probe outputs, added BEP-Deep full_baseline_comparison, and added a baseline-contract audit checking canonical statuses, deep-scope probes, and no internal substitution for unavailable external tools.","Core BEP-Deep results, labels, and existing internal-control metrics were already locked; external packages remained unavailable in the clean environment.","The amendment improves status hygiene and reproducibility but does not convert unavailable external tools into project results, does not add a baseline success, and does not change any semantic finding or negative-control outcome.",closed
2026-06-23,A023_REPRODUCTION_LADDER_CONTRACT,Artifact reproducibility and release validation,Artifact inspection found that the memory-stable release summary was robust but did not itself provide a single inspection-facing executable ladder for the main local closure gates.,"Added a deterministic reproduction-ladder specification and runner that can execute or audit closure gates, hash expected outputs, and record command success without live web scans, hosted scanner calls, private accounts, GPUs, or external inference APIs; added the materialized ladder audit to release validation.",The individual closure gates already existed and passed; the gap was orchestration transparency rather than a missing scientific result.,"The amendment adds evidence-facing execution structure and output hashing only; it does not add, remove, relabel, or reinterpret fixtures, baselines, metrics, citations, or RQs.",closed
2026-06-23,A024_REPOSITORY_RESEARCH_INFRASTRUCTURE,"Artifact code organization, typed semantic kernel, generated tests, and repository hygiene","Fresh repository review found that the artifact had many validation gates but still looked like a script collection rather than a reviewable research infrastructure with a typed IR boundary, generated fixture-level tests, explicit environment surface, and repository-grade hygiene gates.","Added the BEPGuard support package with typed BEP-IR normalization, deterministic oracle tables, generated fixture/certificate tests, repository-quality auditing, environment lock files, requirements metadata, and process-trace cleanup; added these checks to the reproduction ladder and release validation.","The locked BEP-Deep/BEP-Max data, labels, oracle outputs, certificates, mutation results, baseline statuses, citations, and RQs were already fixed before the repository infrastructure was added.","Infrastructure and audit burden only; it does not add, remove, relabel, reinterpret, or rescore any fixture, issue class, baseline, negative control, metric, citation, or RQ.",closed
2026-06-23,A025_SPECBENCH_AND_PROPERTY_VALIDATION,"Semantic validation, proof obligations, source-derived benchmark, and baseline-adapter contract","Expert artifact review found that best-paper-level reproducibility needed validation beyond replayed result files: source-derived boundary cases outside the locked denominator, metamorphic properties, lattice proof obligations, a second certificate checker, and a stricter external-benchmark adapter contract.","Added BEP-SpecBench with 58 source-derived boundary cases covering 22 rules, semantic-lattice proof obligations over 6 contracts and 186 finite states, 9 metamorphic relations over 3954 checks, an independent certificate rechecker over 4870 obligations, and an external benchmark contract audit; added all to release validation.","The 972/418/554 BEP-Deep denominator, 4306 BEP-Max cases, 28 semantic mutants, source claims, baselines, and paper results were already locked.","The amendment adds new validation surfaces outside the locked experimental denominator and checks existing claims more harshly; it does not claim prevalence, exploitability, new baseline success, changed labels, or changed effect sizes.",closed
2026-06-23,A026_EVIDENCE_GRAPH_AND_ANTI_OVERFIT_AUDIT,"Artifact traceability, benchmark independence, and release validation","Fresh repository review found that validation results were individually strong but not exposed as a single queryable evidence graph, and that deterministic benchmark code lacked an explicit guard against memorizing locked fixture identifiers or substituting internal outputs for unavailable external baselines.","Added a BEPGuard evidence-graph builder/auditor connecting source spans, claims, rules, fixtures, witnesses, certificates, paired repairs, negative certificates, SpecBench cases, metamorphic cases, and external-baseline probe statuses; added an anti-overfitting leakage audit over method code, SpecBench disjointness, and no-substitution baseline status records.","The locked BEP-Deep/BEP-Max denominator, labels, certificates, oracle decisions, baselines, and headline results were already fixed; the new layer exposes path closure and guards against benchmark leakage rather than improving a measured outcome.","No fixture, claim, label, metric, negative control, baseline status, citation, or RQ is added, removed, relabeled, or reinterpreted; the amendment adds audit burden and assessor navigation only.",closed
2026-06-23,A027_SPECBENCH_STRESS_AND_STRICT_SMOKE,Source-derived boundary benchmark and executable reproduction smoke gate,"Repository review found that BEP-SpecBench covered important source-derived boundaries but did not yet stress enough benign representation variation, and that the reproduction ladder was mostly a contract unless the assessor chose execute mode.","Expanded BEP-SpecBench from 58 to 116 cases by adding semantics-preserving lowercase-header, reversed-header, and irrelevant-header variants for every source-derived boundary case; added a strict smoke executor that actually runs representative local gates and records output hashes without volatile runtime fields.","All expanded SpecBench cases pass, and the strict smoke gate executes six representative commands successfully; BEP-Deep 972/418/554, BEP-Max 4306, mutation 28/28, and certificate counts remain unchanged.","SpecBench remains outside the locked experimental denominator and is explicitly reported as validation pressure only; no fixture label, RQ, baseline scope, or main-paper effect size changes.",closed
2026-06-23,A028_RULE_MATURITY_CLOSURE,"Source-rule ledger, SpecBench coverage, and release validation","Fresh rule-ledger review found that several source rules still carried future-plan maturity markers even though their semantic obligations were now represented by fixtures, SpecBench aliases, framework-boundary cases, or baseline-scope contracts.","Closed the release rule-maturity ledger by replacing unresolved future-plan markers with explicit encoded or baseline-scope maturity classes across all rule-ledger aliases; added an executable rule-maturity audit checking 35/35 rules, ledger alias agreement, zero planned statuses, and claim/fixture/SpecBench/framework-boundary coverage.","The 35-rule ledger and 38-layer validation were passing, but the maturity wording was weaker than the implemented semantic surface and could invite a assessor to treat some obligations as future work.","This closes rule accounting and coverage language only; it does not add, remove, relabel, reinterpret, or rescore any BEP-Deep fixture, baseline, negative control, certificate, citation, or RQ.",closed
2026-06-23,A029_FINITE_THEORY_KERNEL,Formal semantic validation and proof obligations,Formal-methods review found that lattice and certificate checks were strong but still too close to result replay; the artifact needed a separate finite theorem kernel over the semantic fragment itself.,"Added a BEPGuard finite theory kernel with 10 theorem obligations over 1649 enumerated states covering CSP meet non-expansion, directive specificity, report-only disposition, CORS truth tables and cache partitioning, HSTS state partitions, COEP request-mode separation, CORP scope, Permissions-Policy allowlists, and ordered generation layers.",Existing proofs and certificates already passed; the new kernel was introduced to check semantic invariants independently of locked fixture labels.,"The theorem kernel adds proof burden outside the experimental denominator and reports no prevalence or effectiveness gain; BEP-Deep labels, metrics, baselines, and RQs are unchanged.",closed
